{
  "lebensphasen": [
    {
      "id": "LP1",
      "label": "Kindheit & Jugend",
      "von": 1919,
      "bis": 1937,
      "ort": "Lemberg",
      "beschreibung": "Aufgewachsen in der Ukraine (Lemberg/Lwiw)"
    },
    {
      "id": "LP2",
      "label": "Studium",
      "von": 1937,
      "bis": 1944,
      "ort": "Lemberg",
      "beschreibung": "Gesangsstudium am Konservatorium Lemberg"
    },
    {
      "id": "LP3",
      "label": "Flucht & Neuanfang",
      "von": 1944,
      "bis": 1945,
      "ort": "Wien",
      "beschreibung": "Flucht vor der Roten Armee, Ankunft in Österreich"
    },
    {
      "id": "LP4",
      "label": "Erste Engagements",
      "von": 1945,
      "bis": 1950,
      "ort": "Graz",
      "beschreibung": "Engagement an der Grazer Oper, erste Erfolge"
    },
    {
      "id": "LP5",
      "label": "Aufstieg",
      "von": 1950,
      "bis": 1955,
      "ort": "Wien",
      "beschreibung": "Wiener Staatsoper, erste internationale Auftritte"
    },
    {
      "id": "LP6",
      "label": "Internationale Karriere",
      "von": 1955,
      "bis": 1970,
      "ort": "Wien/Bayreuth",
      "beschreibung": "Bayreuther Festspiele, Salzburg, internationale Gastspiele"
    },
    {
      "id": "LP7",
      "label": "Spätphase & Ruhestand",
      "von": 1970,
      "bis": 2009,
      "ort": "Zürich",
      "beschreibung": "Rückzug aus dem Bühnenleben, Leben in Zürich"
    }
  ],
  "orte": [
    {
      "ort": "Lemberg",
      "typ": "wohnort",
      "von": 1919,
      "bis": 1944
    },
    {
      "ort": "Wien",
      "typ": "wohnort",
      "von": 1944,
      "bis": 1950
    },
    {
      "ort": "Graz",
      "typ": "wohnort",
      "von": 1945,
      "bis": 1950
    },
    {
      "ort": "Wien",
      "typ": "wohnort",
      "von": 1950,
      "bis": 1970
    },
    {
      "ort": "Zürich",
      "typ": "wohnort",
      "von": 1970,
      "bis": 2009
    },
    {
      "ort": "Bayreuth",
      "typ": "auffuehrungsort",
      "von": 1952,
      "bis": 1968
    },
    {
      "ort": "München",
      "typ": "auffuehrungsort",
      "von": 1953,
      "bis": 1968
    },
    {
      "ort": "Salzburg",
      "typ": "auffuehrungsort",
      "von": 1955,
      "bis": 1965
    }
  ],
  "mobilitaet": [
    {
      "von": "Lemberg",
      "nach": "Wien",
      "jahr": 1944,
      "form": "erzwungen",
      "beschreibung": "Flucht vor der Roten Armee",
      "kontext": "Abbruch des Studiums am Konservatorium Lemberg, Verlust aller lokalen Netzwerke. 11 Dokumente aus 1944 belegen die dichteste Überlieferung vor 1950."
    },
    {
      "von": "Wien",
      "nach": "Graz",
      "jahr": 1945,
      "form": "geografisch",
      "beschreibung": "Erstes Engagement",
      "kontext": "Engagement als Altistin an der Grazer Oper — Graz als Sprungbrett für die internationale Karriere."
    },
    {
      "von": "Graz",
      "nach": "Wien",
      "jahr": 1950,
      "form": "geografisch",
      "beschreibung": "Wiener Staatsoper",
      "kontext": "Wechsel an die Wiener Staatsoper markiert den Beginn der Aufstiegsphase. Netzwerk-Intensität verdoppelt sich (7 → 46)."
    },
    {
      "von": "Wien",
      "nach": "Bayreuth",
      "jahr": 1952,
      "form": "geografisch",
      "beschreibung": "Bayreuther Festspiele Debüt",
      "kontext": "Internationaler Durchbruch. Zusammenarbeit mit Wieland Wagner und Knappertsbusch beginnt."
    },
    {
      "von": "Wien",
      "nach": "Zürich",
      "jahr": 1970,
      "form": "lebensstil",
      "beschreibung": "Übersiedlung (Ehemann)",
      "kontext": "Rückzug aus dem aktiven Bühnenleben. Gleichzeitig Beginn der Lehrtätigkeit an der KUG Graz."
    },
    {
      "von": "Lemberg",
      "nach": "Wien",
      "jahr": 1950,
      "form": "national",
      "beschreibung": "Staatsbürgerschaft durch Heirat"
    },
    {
      "von": "Zürich",
      "nach": "Graz",
      "jahr": 1970,
      "form": "bildung",
      "beschreibung": "Professur für Liedinterpretation, KUG Graz",
      "kontext": "Wissenstransfer: Erfahrung aus internationaler Karriere fließt in die Lehre. Graz als Ort der Rückkehr."
    }
  ],
  "auftritte": [
    {
      "ort": null,
      "ort_detail": null,
      "kategorie": "gastspiel",
      "werk": null,
      "komponist": null,
      "rolle": null,
      "jahr": 1940,
      "datum": "1940-12-20/1940-12-31",
      "phase": "LP2",
      "dokumente": [
        "UAKUG/NIM/PL_03",
        "UAKUG/NIM/PL_12"
      ],
      "gattung": null,
      "titel": "\"BOHÈME\" / \"MADAMA BUTTERFLY\" / \"DON QUICHOTTE\""
    },
    {
      "ort": null,
      "ort_detail": null,
      "kategorie": "gastspiel",
      "werk": null,
      "komponist": null,
      "rolle": null,
      "jahr": 1941,
      "datum": "1941-06-01/1941-06-14",
      "phase": "LP2",
      "dokumente": [
        "UAKUG/NIM/PL_10",
        "UAKUG/NIM/PL_11",
        "UAKUG/NIM/PL_13"
      ],
      "gattung": null,
      "titel": "\"CARMEN\" / \"DER ROTE MOHN\""
    },
    {
      "ort": null,
      "ort_detail": null,
      "kategorie": "konzert",
      "werk": null,
      "komponist": "Beethoven",
      "rolle": null,
      "jahr": 1942,
      "datum": "1942-04-26",
      "phase": "LP2",
      "dokumente": [
        "UAKUG/NIM/PL_04"
      ],
      "gattung": "konzert",
      "titel": "SINFONISCHES ORCHESTER / in Stanislau / Konzertsaal Armenierstrasse 18. / Zum Ab"
    },
    {
      "ort": null,
      "ort_detail": null,
      "kategorie": "gastspiel",
      "werk": null,
      "komponist": "Verdi",
      "rolle": null,
      "jahr": 1943,
      "datum": "1943-03-03/1943-03-14",
      "phase": "LP2",
      "dokumente": [
        "UAKUG/NIM/PL_05",
        "UAKUG/NIM/PL_06",
        "UAKUG/NIM/PL_07",
        "UAKUG/NIM/PL_08",
        "UAKUG/NIM/PL_14"
      ],
      "gattung": null,
      "titel": "\"BALLETTABEND\" / \"PAGANINI\" / \"AIDA\""
    },
    {
      "ort": "Potsdam",
      "ort_detail": null,
      "kategorie": "gastspiel",
      "werk": null,
      "komponist": null,
      "rolle": null,
      "jahr": 1944,
      "datum": "1944-05 bis 1944-09",
      "phase": "LP2",
      "dokumente": [
        "UAKUG/NIM_003 1_1"
      ],
      "gattung": null,
      "titel": "Deutsches Musikinstitut für Ausländer, Programmheft Sommerkurs 1944, Potsdam und"
    },
    {
      "ort": "Zürich",
      "ort_detail": null,
      "kategorie": "engagement",
      "werk": "Orpheus und Eurydike",
      "komponist": "Gluck/Händel",
      "rolle": "Orpheus",
      "jahr": 1947,
      "datum": "1947-1952",
      "phase": "LP4",
      "dokumente": [
        "UAKUG/NIM_004 24",
        "UAKUG/NIM_004 29"
      ],
      "gattung": "oper",
      "titel": "Kurzbiografie  von Ira Malaniuk als Typoscript (vermutlich als Anhang eines Brie"
    },
    {
      "ort": null,
      "ort_detail": null,
      "kategorie": "gastspiel",
      "werk": null,
      "komponist": null,
      "rolle": null,
      "jahr": 1952,
      "datum": "1952-12-28/1953-01-06",
      "phase": "LP5",
      "dokumente": [
        "UAKUG/NIM/PL_15"
      ],
      "gattung": null,
      "titel": "Spielplan der Bayrischen Staatstheater / für die Zeit vom 28. Dezember 1952 bis "
    },
    {
      "ort": "München",
      "ort_detail": "Bayerische Staatsoper",
      "kategorie": "engagement",
      "werk": "Macbeth",
      "komponist": "Verdi",
      "rolle": "Lady Macbeth",
      "jahr": 1952,
      "datum": "1952-12-17",
      "phase": "LP5",
      "dokumente": [
        "UAKUG/NIM_004 3",
        "UAKUG/NIM_004 4"
      ],
      "gattung": "oper",
      "titel": "Rezension von Karl Schumann zu Macbeth"
    },
    {
      "ort": "München, Martiusstrasse 3",
      "ort_detail": null,
      "kategorie": "gastspiel",
      "werk": null,
      "komponist": null,
      "rolle": null,
      "jahr": 1952,
      "datum": "1952-03-18",
      "phase": "LP5",
      "dokumente": [
        "UAKUG/NIM_007 1"
      ],
      "gattung": "oper",
      "titel": "Brief von Felix Ballhausen zu Dienstverträgen Staatsoper München"
    },
    {
      "ort": "Wien",
      "ort_detail": "Teatro Colon",
      "kategorie": "engagement",
      "werk": "Salome",
      "komponist": null,
      "rolle": "Lady Macbeth",
      "jahr": 1952,
      "datum": "1952-05-27",
      "phase": "LP5",
      "dokumente": [
        "UAKUG/NIM_007 2"
      ],
      "gattung": "oper",
      "titel": "Brief von Martin H. Taubman zu Verträgen mit Buenos Aires, Neapel, Wien"
    },
    {
      "ort": null,
      "ort_detail": null,
      "kategorie": "gastspiel",
      "werk": null,
      "komponist": "Wagner",
      "rolle": null,
      "jahr": 1953,
      "datum": "1953-05-18",
      "phase": "LP5",
      "dokumente": [
        "UAKUG/NIM/PL_16"
      ],
      "gattung": null,
      "titel": "TRISTANO / E / ISOTTA"
    },
    {
      "ort": null,
      "ort_detail": null,
      "kategorie": "gastspiel",
      "werk": "Orpheus und Eurydike",
      "komponist": "Gluck/Händel",
      "rolle": "Orpheus",
      "jahr": 1953,
      "datum": "1953-03-05",
      "phase": "LP5",
      "dokumente": [
        "UAKUG/NIM_004 5"
      ],
      "gattung": "oper",
      "titel": "Rezension von K.H. Ruppel zu Orpheus und Eurydike in der Süddeutschen Zeitung"
    },
    {
      "ort": "Bayreuth",
      "ort_detail": null,
      "kategorie": "festspiel",
      "werk": "Sinfonien, Nr. 9, op. 125 (d-Moll)",
      "komponist": "Beethoven",
      "rolle": "Alt Solo",
      "jahr": 1953,
      "datum": "1953-08-13",
      "phase": "LP5",
      "dokumente": [
        "UAKUG/NIM_004 7"
      ],
      "gattung": "konzert",
      "titel": "Rezension von Dr. Joachim Bergfeld (Fränkische Presse) zur IX. Symphonie Beethov"
    },
    {
      "ort": "Bayreuth",
      "ort_detail": null,
      "kategorie": "festspiel",
      "werk": "Götterdämmerung",
      "komponist": "Wagner",
      "rolle": "Brünnhilde",
      "jahr": 1953,
      "datum": "1953-08-01",
      "phase": "LP5",
      "dokumente": [